{
  "$schema": "https://json-schema.org/draft/2020-12/schema",
  "title": "MONOLITH Core Knowledge Card",
  "type": "object",
  "required": ["card_id", "title", "summary", "tags", "source_refs"],
  "additionalProperties": false,
  "properties": {
    "card_id": { "type": "string", "minLength": 1 },
    "title": { "type": "string", "minLength": 1 },
    "summary": { "type": "string", "minLength": 1 },
    "tags": {
      "type": "array",
      "items": { "type": "string", "minLength": 1 },
      "minItems": 1,
      "uniqueItems": true
    },
    "source_refs": {
      "type": "array",
      "items": { "type": "string", "minLength": 1 },
      "minItems": 1,
      "uniqueItems": true
    }
  }
}
