{
  "card_id": "card-agent-memory",
  "title": "Agent Memory Belongs In Durable Notes",
  "summary": "Long-running agent workflows should recover context from indexed notes and cards instead of relying on chat memory alone.",
  "tags": ["agent-memory", "obsidian", "context-recovery"],
  "source_refs": ["synthetic:memory-model"]
}
