{
  "card_id": "card-branch-return",
  "title": "Project Branches Return Findings To Core Knowledge",
  "summary": "Reusable findings from a project branch should be linked back to shared core cards through an auditable branch-return report.",
  "tags": ["branch-return", "knowledge-index", "curation"],
  "source_refs": ["synthetic:branch-contract"]
}
